speaker,speech,date,entity
yanis varoufakis,"Thank you, Jeroen. It is our, uh, assessment that the deliberations with institutions have picked up of recent. We are, uh, pleased to report that, at least from our side, it seems as if, uh, a great deal of convergence has been achieved, even though it was not sufficient to reach an agreement, yet. But we are very optimistic and very positive, and wholly determined to make sure that, um, uh, we do our part so that the extra mile is covered within a short space of time. Let me, just briefly, um, mention some areas of agreement and disagreement. Just to give colleagues flair of the kind of progress that we have made, both us and the institutions. Let me begin with the example of tax administration. It was, um, um, part of the previous government’s, uh, commitment to the institutions that, uh, the tax authority, the General Secretariat of Public Revenues within my ministry, should be given greater autonomy. And I believe there was worry amongst colleagues, as well as the institutions that our government would want to claw some of this back, to roll it back. Well, I’m pleased to report that not only are we not doing this, but we now have consensus in the government to actually take it further than what the institutions ever asked for. We are, um, interested in and committed to now creating a fully independent tax authority. Independent both of political intervention, interference, but also corporate interference. And we’re keen to work with the institutions in order to create the- this kind of IRS-like, uh, separate entity that looks after public revenues. And as the minister of finance, I have to tell you, on a personal basis, that I’m very much looking forward not to have such control over public revenues. Also, uh, regarding the independence of authorities such as the Hellenic statistical authority ELSTAT, and the HFSF that Mario, uh, mentioned, I believe it was Mario and maybe Klaus, if memory serves. Uh, let me reiterate our government’s commitment to strengthen the independence of such, uh, bodies, uh, in full compliance with what the institutions and colleagues here around the table, uh, consider to be appropriate. On other issues, I- I just- I will not- I do not propose to go through, uh, very many of them, because this is something for us and the institutions to work out in the Brussels group and so on and so forth. But just- I ju- I just want to give you a flavor of the progress as we see it and the reason why we think that we are, uh, on the right path. Maybe we should be moving forward faster, but we are nevertheless on the right path. Uh, take the issue of VAT. There is a disagreement of sorts between us and the institutions regarding the emphasis. Our emphasis goes on collection. Let me give you a brief example. Last year on the famous islands of Mykonos and Santorini, we had tourism, economic activity, tourist activity doubled, and yet disgracefully, absolutely disgracefully, VAT collection went down by 30%. This has nothing to do with the rate of VAT. That has to do with the failure of our tax authorities to collect it. So we put more emphasis on- on collection- on the collectability. The institutions put more emphasis on harmonization and looking at different rates, but I have no doubt that in good faith we can work this out, we can hammer out an agreement on this, uh, which I will not now bother you with as to how exactly it will be- it will manifest itself. On the question of privatizations, I heard Pierre, uh, mention that and- and- and- and Paul mention that there’s been backtracking. I don’t believe that backtracking or rolling back is apt as a description of what we’re doing. After a few weeks of deliberating as a new government, we have now come to a very clear position on this. We are continuing with the privatization drive, only we are resetting the parameters in a way that I think that colleagues, if I was given an opportunity to explain, my se – my hunch is colleagues would agree with what we’re saying. What we’re saying is that privatizations must happen in a way that, um, removes them from the realm of fire sales, which is what we’ve had in the past few years. So, it is not that we are slowing down privatizations, it is that we want to put greater emphasis not on the sale price, but on things like minimum investment provisions by the bidders. We want the state to retain an equity, like it happens in many other European countries around this table. We want to have-uh, in case of regional airports, let’s say for example, we would like greater commitment and planning for an integration of, uh, the new activities in these privatized facilities, with the local economies. So, our purpose is to remove the emphasis or to shift the emphasis away from the, uh, just, you know, the- the asking price or the bidding price and placing it- shifting it towards greater developmental, uh, um, impact and the multiplied accelerated- accelerated effects that these will have. Shifting on very quickly to the question of labor markets. Now, this is where we may agree to disagree with Paul and maybe some others. We believe that, uh, a labor market like Greece’s is not just excessively deregulated as it is, in practice, not so much in law but in practice. But it is a labor market that should all make us particularly worried regarding the degree of informality. When you have a labor market, which has shrunk significantly due to the recession and on top of that, more than 30% of paid labor is informal undeclared labor, one realizes that standard arguments about deregulation fail to connect with the reality on the ground. So, when we talk about, for instance, a role for collective bargaining, that is not simply a return to what we had before, this is not what we plan to do, but a kind of smart collective bargaining framework, um, not different to the one we have in Germany or in other European countries, uh, hammered out and designed together in association with the International Labor Organization for instance, uh, would help bring about a large number of workers into the formal sector again and therefore strengthen the pension system and strengthen our tax state. Uh, non-performing loans is a major issue. It keeps the credit circuits from functioning properly. It keeps our export-oriented companies from being able to fulfill orders and to finalize their transactions with, uh, their customers abroad as a result of the failure to secure letters of credit from the banking sector. These are all issues that we’re discussing with the institutions. These are all issues that we want to settle. And which I think we’re making considerable progress in finding common ground with the institutions. But be- uh, let me finish with a couple of, uh, points. All this, as Pierre very succinctly said, has to be, and I’m sure that Mario and Paul too would agree with, has to be embedded in a dynamically consistent fiscal plan, a dynamically consistent debt sustainability analysis. We are undogmatic about this. We don’t have any fixation about what the primary surplus should be. What we’re concerned about is the method, the method that has been, uh, utilized so far of saying, okay, in 2020, we want a particular debt to GDP ratio, let’s say 120% and now let’s work backwards, and their assumptions about, regarding the growth rate of, let’s say, 3% on average, what the primary surplus must be in 2019, ’18, ’17, all the way to today. And then we end up with a primary surplus, which in our estimation is not consistent with a growth rate, which is implicit, the assumption, for working out this kind of path. So this is a kind of consolidation trap that we want to avoid. And we want to discuss it with the institutions, the DSA, that actually makes dynamically consistent sense. And this is an area of disagreement so far, but this government is absolutely committed to signing on the dotted line of a fiscal plan that makes sense, to us, and which we can fully commit to. Unlike previous governments, you -you will allow me to say, we are not prepared, prepared to make pledges just in order to unl- unlock liquidity that we do not believe are possible to attain. And I hope that the- our partners, the institutions, everyone around this table takes this in good faith and recognizes that this is a government that wants to make pledges that it can fulfill. Finally, on the question of liquidity, I’m very much afraid that we are talking about very few days- week, less than two weeks before we have a serious, uh, chance of an accident. And it is our considered opinion that it will be a shame that these negotiations, which in our estimation, are proceeding along the lines that all of us want and which may very easily, uh, in the next few days or weeks, attain an agreement that is mutually beneficial to everyone, uh, be derailed by a liquidity, uh, sourced failure. Uh, we believe that sufficient progress has been made. And we are determined to put on, uh, to demonstrate constantly our utter commitment to making this negotiation bear fruit, so as to enable the Eurogroup very shortly, even possibly through a teleconference, to make the statement which is necessary in order to create conditions for, uh, relaxing the liquidity constraint. I shall close Jeroen by saying that I understand the view that only major pressure can progress be made and that includes liquidity pressure. But let me also say that too much pressure, too much duress may cause, can cause a breakdown of a negotiation perfectly capable of yielding a successful agreement. So I urge colleagues to help prevent this by creating a roadmap, both for the institutions and for the Greek authorities for what follows over the next few days and weeks. Thank you very much.",2015-04-24 00:00:00,Greece
jeroen dijsselbloem,Thank you Yanis. We open the floor to ministers for any comments or questions on the process and the substance so far. Peter?,2015-04-24 00:00:00,EG President
peter kažimír,"Thank you. Unbelievable. This is my feeling, what I heard just now. Okay, formally I would like to start with this that, I would like to thank, I think all we should thank to the institutions and the ESM for their work both in Brussels and in Athens. Uh, it’s true that that our Greek partners have finally started to open up in the talks but honestly we need a quantum leap forward than where it is now. Uh, we have agreed in February to have a comprehensive list of reforms by end of April. We don’t have it. Instead, we saw reluctance to corporate, backtracking on some measures adopted before elections and fiscal sustainability is volatile. Uh, personally though last month I refused to the union of pensioners in my country. I refused a proposal of a 13th pension introduction in my country. Why? Because medium term objective, fiscal responsibility, fiscal consolidation in my country. You can pay out additional pension to your pensioners if you have money enough. Do we have money enough? I cannot support any agreement with you and at the same time refuse the 13th pension in my country and to just observe 13th pension in your country. And this is backtracking of a measure that, which is, we regret in different ways. So we talk but substance is still missing and so, on this question is if we are still on track to meet our June deadline, this I think is the only question for us. And okay we are ready to help Greece but if Greece doesn’t want our help and conditions accompany maybe the time has come to talk consequences. Thank you.",2015-04-24 00:00:00,Slovakia
martin,"Thank you Jeroen. As we all know, there is very little time left so we need to, have to make the best use of it. It is now important to get rid of the remaining obstacles to represent talks. The institutions need access to buildings and information in Athens both at the technical and the political network. Symbols can be important, but this is important that we must concentrate on results not symbols.",2015-04-24 00:00:00,Unidentified
jeroen dijsselbloem,"Our colleagues, let me try and draw a conclusion possibly that is going back to what we agreed on the 20th and 24th of February where we were quite clear that the program could be, would allow for some flexibility if it would remain within the key targets of the program. In other words the program had to stay on track. We are now very close to the end of April and my understanding from the institutions even though Yanis is a little more optimistic is that very very little progress has been made. Um, I don’t think it’s useful to set new deadlines. I think we have to hold the energy in uh, to work on an agreement as soon as possible within, fully within the agreement we had, the statement of the 20th_february, Having said that I think the way the process is going so far we cannot continue. So I will talk with the institutions and with the Greek governments on how to redesign the program. It has been fragmented, it has been inefficient, and the institutions have simply made it clear to us just now that the work cannot be done and an agreement will not be reached if we continue this way. So the process has to be redesigned to pick up the pace. On substance, I think we have uh, a reasonably clear picture of what the key issues are. Um, I feel that uh, it’s going to be difficult to reach an agreement but I also feel that we have to. Uh, and I think that hard work will have to be put in. I will not be optimistic about reaching an agreement before the next Eurogroup so therefore, I will refrain from talking about new deadlines or aiming for an agreement before the next meeting, because as Wieser said we would need an agreement, on a technical level within a week and where we are now I don’t think that is reasonable unless miracles happen. So uh, after the meeting I think it’s important that with the institutions and the Greek government we talk about redesigning the process to get it at a higher level and a higher pace. Um, that is ",2015-04-24 00:00:00,EG President
wolfgang schäuble,"I just want to understand what does it mean uh, to redefine the progress? What does it mean? the process? Only the process? That means that uh, we should at least, that something should happen that we had agreed it should happen month before. What does it mean? Redefine the process? I think  solution.",2015-04-24 00:00:00,Germany
jeroen dijsselbloem,"Um, on process what has happened and this was a concession to the Greek government, we have uh changed the process which traditionally takes place with the troika institutions going to a capital and working there in a very concerted and concentrated manner with the authorities in the ministries with ministers uh, and on request from the Greek government we have had a fragment process with some talks going on in Brussels, some work being done in Athens, very difficult, little access certainly in the beginning and I think that it is key to go back to a very comprehensive approach uh, allowing access in Athens. And having the main talks in Athens without the distinction we’ve tried to make so far on request of the Greek government between negotiations and technical work. This has to be brought together uh, the only way we can get this process going. Um, I think we still should put in, all of us, the effort that we can to find this agreement. It will take a lot of steps from the Greek government, absolutely no doubts about that and whether they are willing and able to do so is to be tested within the next days and weeks, as time is running out. Any other comments at this point?",2015-04-24 00:00:00,EG President
hans jörg schelling," how should we solve this problem? If it necessary to make a new set up to bring it to progress, then it’s ok. But uh, we lost so much time in the last weeks and months that I cannot believe that it is possible with changing the set ups. If it is possible to change the set up, with changing the set ups does it make progress or a solution? And uh, as I told in an interview, that we cannot make a decision because we have not the right information. We have no documents. Uh, you called me a liar, so I have to present this in an Austrian newspaper so this is not a problem for me uh, to make this discussion about fact. We don’t know exactly what is the financial situation of Greece, we don’t know uh, which part of the list of report should be canceled or continued. What is the time starting with this report and uh, therefore it’s, in my opinion, not possible to follow this set up and this way which we have, since maybe half a year. So please can you tell us what you plan to bring in the next 2, 3, 4 or 5 days to reach that what Thomas said, to bring up uh, a statement which is necessary for the next discussions on the political level in between the next week. Uh, if you look at the progress of the last month I cannot believe that its possible in between the next weeks. So that’s for us in the political discussion a big problem.",2015-04-24 00:00:00,Austria
jeroen dijsselbloem,Thank you. Pierre come in.,2015-04-24 00:00:00,EG President
pierre moscovici,"Thank you Jeroen. Um, first of all I’d like to say from the outset that uh from our side we would really like to be able to do everything that we find a solution uh, with Greece. A positive one. But I am very worried from the way the discussion goes today uh, I have carefully listened to the three institutions and they have listed all the problems that are still there, they are not new and that are not being solved. And I’ve heard our Greek partner Yanis telling us what he told us ,but apart from the issues that deal with the collecting taxes, which we all would welcome I’m sure, I haven’t heard not a single point where I felt that uh, he was ready to move in the direction that we are expecting. And as Wolfgang Schäuble said correctly, I also think we are moving in the wrong direction instead of moving in the right direction. And I’m very worried about that. Um, on top of it its really unfortunate that there seems to be roll back on certain measures. I say it seems because it’s very difficult for us in a distance to really appreciate the situation in some cases and on some issues and that’s obviously contrary to our 20th_february agreement. Now if that is so, I’m afraid that it’s not enough Jeroen, although I support your proposal, it is not enough to change the way we do the negotiation. It’s obviously unfortunate that there is no contact at political level and at administerial level but that alone will not do it. And I am very worried of what we’re going to say when we walk out of this room if we just say that we changed the procedure because then it’s the credibility of the whole negotiation that is put into question. And the credibility of the whole Eurozone. And last but not least, I think we have a time issue. The liquidity problems of Greece are going to happen in the next two weeks as far as I understand, and to find a global agreement in our framework will take more than two weeks uh, for sure because we have not yet received the detailed plan from our Greek friend. And even if we were to receive it in the next couple of days, I understand that it would take much more time to find eventually an agreement on it. So I think we have here a timing issue that we have to re-discuss it together. So I’m afraid I’m not offering a lot of solutions but I’m asking quite a few questions, but I think the credibility of the process needs to be really looked at.",2015-04-24 00:00:00,European Commission
jeroen dijsselbloem,Luis?,2015-04-24 00:00:00,EG President
luis de guindos,"Uh, thank you Jeroen. Just one question. I think that my perception from today’s meeting is that there is a big gap between expectations and the reality. Uh, and I think that’s when we have to face a situation with such a gap, I think that it is truly important to handle expectations and communication. So I think that uh, well I fully agree with you that to set new deadlines perhaps is not wise, but I think that we need something to say, in our communication. I don’t know if you have prepared some messages because well, we are running out of time. We have a very short period of time and I think that we have to try to do our utmost. That in order, uh, to find a solution but I don’t know what message we can convey today after this meeting.",2015-04-24 00:00:00,Spain
jeroen dijsselbloem,Dusan?,2015-04-24 00:00:00,EG President
dušan mramor,"As I’m listening to the explanation where we are after February’s agreement, what we would do in next months until April, I just cannot conclude anything else but that there is no viable plan uh, set in motion here. And uh, its  according to my assessment it’s not the problem of liquidity, it’s the problem of solvency of Greece and there’s no plan how to make Greece solvent again. It’s no way that I can persuade Slovenians, which are the most exposed to Greece, that they would put additional effort into helping Greece getting out of this situation. So actually I think we should talk about plan B here, we had so many months, two months to solve a question. With a few days now, a few weeks, I don’t see how we can get there. I know we didn’t want to talk about Plan B because we really wanted, including Slovenia, wanted this would be resolved the way that we planned together, but now I don’t see  from February on.",2015-04-24 00:00:00,Slovenia
jeroen dijsselbloem,Michel?,2015-04-24 00:00:00,EG President
michel sapin,Foreign language ,2015-04-24 00:00:00,France
jeroen dijsselbloem,Thank you.,2015-04-24 00:00:00,EG President
pier carlo padoan,"Thanks Jeroen. Actually Michel anticipated many of the things I wanted to say so very briefly let me just stress a few points. I just I have one point only and the point is let’s not fool ourselves. Let’s not try to pretend that nothing is happening. Here the framework which was agreed in February is simply collapsing. Uh, the framework we had agreed in February was that Greece needed to have a short term, few months, effort which was categorised under the extended program because this was needed for its own sake. But this was also needed to move to the next stage where the deeper structural issues that Greece has to face would be tackled with a medium term approach. Now we are risking to fail on both fronts. Uh, we hear that time is short. Liquidity is running out in spite of the huge amount of liquidity that, as Mario just reminded us, was given to the country. In proportions that are unprecedented in the Euro zone. So that amount of liquidity tells a lot about the time that has been lost. So I am deeply frustrated by the fact that we are facing a situation which is very difficult to communicate by. Let’s not fool ourselves without  this is not understood. Unless we dramatically change gear both in process and in content. It’s not about completing the reform program in two weeks. It’s about saying that this is a fresh start about issues that have to deal, first of all with the welfare of the Greek people. But then also with the obvious fact, obvious to me at least, that you need at the same time build a structural reform program which boosts growth and enhances welfare and consistency with  figures in terms of fiscal and monetary. Otherwise, it doesn’t work. Let’s not fool ourselves. So this is just to share my frustration and I apologize to colleagues about this. But we are not, we do not have the luxury of st- we are losing time.",2015-04-24 00:00:00,Italy
speaker 19,Just a short remark. I think it’s fairly clear that in terms of the process something fundamentally is wrong. Uh and that we need to change that is obvious. Now I think .,2015-04-24 00:00:00,Unidentified
jeroen dijsselbloem,"Absolutely. Um, Edward?",2015-04-24 00:00:00,EG President
edward scicluna,"I don’t mean to be dramatic because it is dramatic enough. Um, I think we’re on such a self-destructive path that I can’t see ourselves going out there meeting the media or . Find a solution today because uh, just saying May and then June, I don’t think there’s going to be any change. So there aren’t going to be any solutions or miracles as some people have referred to. They have to happen in this week.",2015-04-24 00:00:00,Malta
jeroen dijsselbloem,Okay. Rimantas?,2015-04-24 00:00:00,EG President
