speaker,speech,date,entity
jeroen dijsselbloem,"… of your responses or questions. And can I first, first ask the Commission,  or Pierre, to uh, give their headlines.",2015-02-24 00:00:00,EG President
speaker 2,"Uh, yes, uh, thank you, Jeroen. Well, uh, commission, uh, has, uh, carefully reviewed the reformed proposal sent yesterday to the, uh, President of Eurogroup. And, uh, this has been preceded by, uh, contractual exchanges, uh, over the weekend between the, between the Greek authorities and, uh, European commission, and also other, uh, institutions. So, in the review of the commission, this list is sufficiently comprehensive to be a valid starting point for a successful conclusion of the review as called for by the Eurogroup at it’s last, uh, meeting. Let me stress, uh, however, that the list does not include sufficient detail to allow us to assess each specific measure, and how that impacts on a budget, or on the overall program targets. Further specification of the reforms in this and other key areas, uh, is expected to be provided and agreed before the end of April. This is also in line with last week’s, uh, Eurogroup, uh, statement. Uh, we consider the Eurogroup statement of the last Friday as a basis.",2015-02-24 00:00:00,Unidentified
michael noonan,Michael Noonan.,2015-02-24 00:00:00,Ireland
speaker 2,"Uh, it is therefore regrettable that, uh- … that the letter by the Minister does not, uh, directly to refer to the commitments in this, uh, statement, such as, for example, to deliver primary surpluses and financing proceeds  to guarantee that sustainability in line with November 2012 Eurogroup statement. Uh, we also find it rather unusual that the letter is not formally signed and does not refer to any actual government decision in this context. So the legal status of the letter is therefore not fully, uh, clear. Uh, importantly, this list does not substitute in any views, uh, memorandum of understandings, which constitutes the official legal basis for the program underpinning the master financial assistance facility agreement. It is also important to recall that the Greek authorities are permitted to refrain from any rollback of measures and unilateral changes to the policies and structural reforms that would negatively impact fiscal targets, economic recovery or financial stability as assessed by the institutions. Uh, Any policy initiatives therefore, should be discussed ex-ante with the three institutions. And now I would ask Pierre to, uh, elaborate further on some critical, uh, details.",2015-02-24 00:00:00,Unidentified
pierre moscovici,"Um, okay colleagues. Um, in general I would say we are encouraged by a number of commitments in  consider at all times the new government must, uh, take, uh, immediate visible steps to show determination for change in these areas. Believe a revision of the legal framework is, uh, needed. In other areas, urgent and deferential, uh, in- … urgent deferential and immediate decisions ought to be taken, uh, as the uncertainty of the past weeks has been, um, damaging and destructive. First, in the financial sector we believe the government must reiterate as soon as possible, in a very clear manner, uh, that key pillars of reform as agreed under the MOU, uh, to settle the markets and diplomatics. Uh, similarly, um, taxation and installments, the government must take urgent action, uh, to clarify it’s intentions, so that taxpayers begin to pay again taxes and social security contributions. And decisions should be taken, uh, swiftly in a full, uh, consultation with these three institutions. Uh, second, on privatization, um, our feeling is that the government should instruct the agency to proceed with the ongoing standards also swiftly. So, the commission, uh, looks forward to, to, to, to working with the new administration to, to elaborate what are, are still at the moment general commitments, and transform these into, uh, clear policy actions. We would also like to underline our willingness to continue to provide, uh, technical assistance in key areas, to, to assist in the design and, and the implementation of policies. Uh, to sum up, I won’t be longer, in the view of the commission, this is, is sufficiently comprehensive to be, uh, a valid starting point for a successful conclusion of the review. It is not at all something that means that the review is concluded or on the way to be concluded, and I think this was, uh, what we were asked by the Eurogroup, and our answer is clear on that point.",2015-02-24 00:00:00,European Commission
jeroen dijsselbloem,"Thank you very much, uh, as always, Pierre. Uh, let me turn to the uh, ECB. Mario?",2015-02-24 00:00:00,EG President
mario draghi,"Yes, thanks Jeroen. Thank you. As, uh, as we discussed the… in such short time, was certainly not possible for the authorities to come up with their own list of complete proposals and commitments, which would allow us, the institutions, but especially ECB to assess the impact on growth, public finances and financial stability. I note that the commitments outlined by the authorities differ from existing program commitments in a number of areas. But having said that, the list sent by the Greek authorities covers a wide range of reform areas, and in this sense it’s appreciably comprehensive to be a valid starting point for a successful conclusion of the review. Now, let me make a few additional remarks. We understand consistently with the Eurogroup decision last Friday, that the list doesn’t call into question that the current arrangement, and asks existing commitments in the current MOU and MEFP are the basis for the review. In cases where the list deviates from the MEFP and the MOU, we will assess during the review, where the measures which are not accepted by the authorities are replaced with measures of equal or better quality in terms of achieving the objectives of the program. We would appreciate if the Greek authorities would make very clear and public that there will be no rolling back of existing reforms or commitments in any of the areas mentioned in their list. Any new measures or laws in these areas will only be implemented once agreed with the three institutions. Unfortunately we still continue to hear conflicting messages between the communication to the Greek general public and the comit- and the commitments to this group. Second point concerns the payment culture. The list we are discussing today was not used for this purpose. In the coming days, we would expect very clear statements from the highest levels. The concern is to previous announcements. First, there will be no initiatives by the government on broadening or relaxing installment schemes, and the measures to strengthen tax enforcement and payment discipline will urgently be discussed with the three institutions. Unfortunately, even this morning, we are hearing conflicting message from Athens. Second, there would be no new moratorium on auctioning of residences, nor any other restrictions, which makes it difficult for banks to effectively work out the NTLs. I think it should be in the interest of Greece, first and foremost, to have a viable credit system. If banks are not viable, they won’t give any credit. I made this point several times. There will also be no initiative for any general or horizontal debt relief for private creditors. I mean, Jerome, with your agreement I would like to make a point on the difference between the Eurogroup statement and uh, this, uh, the statement here about the  bonds for bank recapitalization. Can I make it now?",2015-02-24 00:00:00,ECB
jeroen dijsselbloem," bonds, uh, would take place. It would be… it would take place on the basis of the ECB SSM decision. They are the ones who trigger the use of these funds, uh, for recapitalization purposes. Uh, that’s what we agreed in Eurogroup. Uh, any further debate on that issue, I think, should be… should take place in the Euro Working Group, if that’s all right.",2015-02-24 00:00:00,EG President
mario draghi,"Thank you, Jeroen. So I… I understand as the draft amendment of the master financial assistance facility agreement that has circulated yesterday will be in line with the statements agreed on Friday.",2015-02-24 00:00:00,ECB
jeroen dijsselbloem,"Yes. And if anyone has any further comments on that, then I think it should take place in the Euro Working Group, uh-",2015-02-24 00:00:00,EG President
mario draghi,"Okay. Thank you. Then for me, if I have this assurance there is no need to raise this point. Thank you. Then I’m finished.",2015-02-24 00:00:00,ECB
wolfgang schäuble,"Sorry, may I, may I… Jeroen, can I take this ?",2015-02-24 00:00:00,Germany
jeroen dijsselbloem,"Yes, please.",2015-02-24 00:00:00,EG President
wolfgang schäuble,"Uh, I would be… Uh, uh, it must be totally clear, because I will cr- it will create, uh, in- incredible problems in my parliament. We have in, in no way any amendment through the given agreement. We have stated in… on, on, on Friday, um, onto the . Therefore, my, my, my, my demand is only don’t create the discussion or misunderstandings that there will be any amendment, uh, to the, to the given agreement.",2015-02-24 00:00:00,Germany
jeroen dijsselbloem,"Um, don’t worry uh, Wolfgang, there will be no changes or amendments to the statement we, we saw Friday. In that particular sentence, there are two aspects. One is, as you said that it’s… the release of these funds will be on request by the SSM, but you could also read they will be released on request by the SSM. In other words, formally, there may be a decision to be taken, um, but they will be released on request by the SSM. In other words, if the SSM finds it necessary, this recapitalization, the funds will be released. So there are both aspects in one sentence. Um, we’re not going to change the statement, that would cause a lot of problems of course. Uh, if anyone wants further clarification, I think it should take place in the Euro Working Group. It’ll be about procedures, but not about the political decision we took. If, um, I may be continue, I would like to, uh, ask, uh, Christine, for her assessment.",2015-02-24 00:00:00,EG President
christine lagarde,"Thank you very much, Jerome and good afternoon to all of you. I will not repeat the content of the letter that we issued last night. I could, uh, literally endorse and exalt all the points made by Mario, except the last one, which is quite separate. The two points I will come back to to insist upon, is number one, that the discussions on completion of the review, which should start as soon as possible, and for which we are ready, to be successful, can not be merely confined within the policy parameters outlined in the government list. And I think the reference to the MOU and the NESP by Mario was particularly relevant. The second concern that I have, which was also mentioned by Mario, is the constant and recurring noise that we hear from Athens, and which echo around the world in a way that is inconsistent with what is indicated in the memorandum of the list issued by the Greek authorities. And there is real constant reference to backtracking. That includes expectation of im- impending changes to the pension scheme that backtrack on policy commitments, as well as changes to the general tax, uh debt installment fees, that already have, uh, weakened, uh, the revenue collection by the Greek authorities. So, Yanis, if you would, with us on the call, I would urge you to reduce that noise and make very clear that there is one single list and not a Greek list separate from your list. Finally, I think it could be extremely helpful, certainly from our perspective, if, uh, Yanis could explain to all of us the government’s current liquidity position, as well as how it is proposed to move forward. With that, as I said, uh, we stand ready, and we’re eager to, uh, begin the real work, which will not be about putting, uh, words on, on paper, which will, we’re not associated to over the weekend, but that’s fine. But clearly, the actual review work now needs to begin. Thank you.",2015-02-24 00:00:00,IMF
jeroen dijsselbloem,"Thank you Christine. Um, I would now like to turn to Yanis to pick up on a couple of points raised. Uh, I think we all fully understand that the detailed work has yet to begin. Uh, and we must all fully understand that all the legal documents and the basis for the program of support is unchanged until further, um, works out, details discussed and agreed with the institutions. So that’s the basis on which we, uh, work. Uh, Yanis, can I ask you to react on the couple of issues raised by, uh, Mario and the Commission, uh, Christine?",2015-02-24 00:00:00,EG President
yanis varoufakis,"Yeah, sure. Thank you so much, uh, Jeroen. Let me… how I would begin by thanking, um, you, as the president of the Eurogroup, for your role in helping establish the necessary common ground to reach where we are at present. I also want, want to thank the institutions for, uh, um, the constructive relationship we had over the last 48 hours, and for so swiftly reading our list and coming to the verdict or the recommendation that you have come. I do believe, and the government believes, here in Athens, that we now have a firm basis on which to build a solid agreement, and, uh… for the next four months at least, and, uh, work towards, uh, the review. Let me now, uh, do as, uh, you said Jerome, and address, uh, some specific issues that were mentioned. Um, there are some minor issues which we can deal with very, very swiftly. That the letter wasn’t signed, it was sent at midnight, so, um, there were technical issues involved there, but we can deal with that. This is a response to one of the commissions points. Um, the question of no unilateral moves, and the need to collaborate with institutions in everything we do has been mentioned by all three institutions. I shall convey this view to my government. It is our in- intention not to make any such moves, as we have stated in our letter to the Eurogroup. We have, uh, every intention to collaborate with institutions and to make sure whatever we introduce in parliament and whatever measures are, um, discussed and deployed, uh, should be discussed and deployed in conjunction with agreement with institutions. Pierre Moscovici mentioned, uh, ELSTAT, the Greek statistics office, and suggested there should be no revision of the legal, um, framework and the autonomy. We understand perfectly well the need not to return to the bad old days of Greek statistics, and we as a government have absolutely no intention whatsoever of interfering with the work of ELSTAT. But let me say that this kind of autonomy has to cut both ways, in the sense that both Eurostat, and the Greek government, and every member state and all the institutions must have, um, confidence in the workings of ELSTAT. At the moment, I cannot tell you that I do. That is a separate issue from, uh, keeping ELSTAT at an arms length from government. What I would like to do is discuss with institutions and with Eurostat, ways in which we can regain confidence in ELSTAT. But that is completely separate from the point that Pierre Moscovici made. I shall reiterate the point. We shall under no circumstances, uh, do anything to jeopardize the autonomy of ELSTAT, uh, and we shall do nothing without the consent of the Commission of the IMF, of the ECB, uh, of the Eurogroup in this direction. But I do believe, this is the view that some of us in this government have, who’ve looked into the operation of ELSTAT over the last few months, that we need, uh, for all of us together to have another at the way that ELSTAT functions. Uh, but again, let me make this very clear, this is not something we intend to do alone. We want to do it in conjunction with you. Regarding the financial sector and tax compliance, this is a point that each one of you made, each one of the institutions made, um, there is, um, lack of trust regarding installment schemes. Let me remind you that this installment scheme that is now on the statutes in… here in Greece, was introduced by the previous government. And I do believe that, uh, the institutions had, uh, objections to that. We are happy to look at these, uh, installment schemes together with our… with, with institutions and with all our partners. There is a very crucial problem here. Th- th- th- th- the level of arrears, uh, tax arrears, as you probably all know reaches 90 percent of the Greek government budget. Now that is a huge amount that has to do with… is a result of the deep crisis of this, uh, social economy. And we need to deal with this, and we need to deal effectively with it by ensuring that whatever it is that we do does not encourage, indeed, punishes strategic non-payment, while at the same time finds ways of dealing with dealing, of giving those who can afford to pay a portion only of what they owe a way of doing this, especially given the current state of our financial situation. Um, on the NPLs, and I take very seriously what Mario Draghi and the ECB are saying about the need to, um, ensure that the capitalization of banks is not threatened by, uh, our policies regarding, um, NPLs. Again, it is important to note that we have very special circumstances in Greece, which I’ll not do… make any, um, uh, unilateral move on this, and of course we need to have the backing of the ECB in everything we do. But let me…since we are talking about this, let me point that, that there are special circumstances. We have a realistic market that has tanked and the notion that we are going to have options of first residences in order to bolster the capitalization of the banks is one that, uh, that needs to be discussed. And, uh, we need to discuss it with you. This is not the venue to do it. But there are serious worries that a massive increase in auctions, uh, in the tanking market is not going to help the banks while at the same time is going to create side-effects in the capacity of the social economy, both to increase, uh, the tax take of the government, and, uh, to increase economic activity. But let me say that, uh, this government is determined to discuss with institutions and arrange common agreement with them on how to deal with these, with these matters. Now, on the question that Mario Draghi raised regarding the FSF and the HFSF, uh, let me just state that, um, for the record to rest everyone… um, rest assure everyone that this government is not going to request for an amendment of the Friday Eurogroup agreement. Um, we are more than happy to go along with that agreement, and to see the FSF retain the control of the remaining funds, in order to use them for the purposes of recapitalization of the banking sector and resolution, possible resolution. Uh, on the, on the question of, uh, a rollback, especially when it comes to privatizations, um, on this matter, as you will see from our… from the relevant entry in our list, we have, uh, made it very clear that completed, uh, um, completed, uh, privatizations are going to be considered to be sacrosanct from this government. The ones that have been launched will be dealt with in accordance to the law, and in ways that, uh, combine the public interest with the need, the necessity of collaborating with institutions and with the Eurogroup. Let me finish by, uh, addressing Christine Lagarde’s two points. The first one is an assurance that I can give Christine and everybody in this conference call that there exists no separate Greek list, separate from the one you have. Of course, as you can imagine, our… this list is only, uh, a five page document. Uh, we have, uh, um a series of, uh, commitments to the Greek public. We shall not make any moves, as I said before, that, uh, undermine the bonds of trust that we are trying to build currently. Um, but there is no such thing as a separate Greek list. There may be different interpretations of, uh, the current, uh, state of negotiation, of exchange between us, of commitment. And let me just make this t- t- this point a bit more tangible. I heard from all three institutions the statement that, um, this list is not a replacement of the MOU, and that this list is going to simply being grafted upon the MOU or we will have to negotiate ways in which the current MOU will have to be amended. Now, as you know, we’ve spent three Eurogroups discussing the imperative of combining the existing program with, uh, the, the new government’s priorities. And I th- I have… I am… I was under the impression, and this government was under the impression that we are making a fresh start without challenging the legal existence of the MOU. We shall insist on maintaining, in a collegial manner, this constructive ambiguity, um, and we are going to try do, to do our, ou- our, our best in order to ensure that the review is completed, on the understanding that this governments, um, um, list that you have in front of you, is taken, um, as the starting point regarding th- th- the judgment that is going to be passed upon us over the next four months. The next four or five months is a very short space of time. If we can do what we agree that we should do by April, um, and do it in the spirit that con- that confirms both the existing program and the intention of moving on, and moving ahead, and moving to a new relationship after June, I think that will be an excellent way of moving ahead. I was asked also by Christine Lagarde to explain the liquidity condition of the government. I’m not in a situa- in, in, in, uh, in a position to do this presently. Uh, the… as you kn- as everybody knows, especially the International Monetary Fund, our liquid- liquidity condition given the destabilization of the Greek economy over the last two months, uh, is not good at all. But my understanding was that today, what we are doing is we are setting the scene, establishing the base, the foundation, for beginning immediate discussions on all those matters including the fiscal cap that we are facing over the next few weeks, in particular, the repayments of the IMF loans in installments, which are coming up soon. Um, it was a discussion we couldn’t have until today’s hurdle has been overcome, but it is a discussion that we are prepared to begin even tonight, if you so wish. Um, I think I have spoken enough. I want to thank, once more, the institutions. The way I understand this conference call is to answer the question whether our list is sufficiently comprehensive to act as the starting point of a process that will stabilize Greece and our relationship with, uh, the Eurogroup and the institutions, in order to build trust and to move ahead. Thank you.",2015-02-24 00:00:00,Greece
jeroen dijsselbloem,"Thank you, Yanis. Um, let me for, uh, opening, uh, the, the, the floor to other ministers. Uh, we iterate that the basis that we are working on is the Eurogroup statement which, um, uh, talks about on the base of the framework of the existing arrangements, uh, underpinned by a set of commitments which are then spelled out. And I think one of the key ones there is that starting from the current arrangement, there can be use of the given flexibility that had to be always after consulting and agreeing with the institutions any changes to the arrangements. I think that could… that clear issue, and you underlined the, um, uh… how the Greek government is committed on this point. Um, on top of that, we now have the list which is a third list of reform measures, based on the current arrangements and the institution that provided us with their first views, which, um, uh, was, if I summarize it, that the list is sufficiently comprehensive to be a valid starting point for a successful conclusion of the reissue. Um, I think those are the key, uh, elements. This is where we are, this is how we will work, and all of this… If the national procedures are started and successfully, um, finished by the end of the week, then, very intensively, the work can start on many of the issues that were brought up, uh, and, um, many of the issues that you mentioned. Now I’d like to-",2015-02-24 00:00:00,EG President
christine lagarde,"Jeroen? Jeroen? Can I, can I just come in for uh, uh, a few seconds to, um, reinforce your point, and also mention just for the clarity of what we bring in the next few days, that the review is a comprehensive review. It can not be a scattered, fragmented review of some items and not others. It has to be comprehensive in order to lead to success, and then . But it’s comprehensive.",2015-02-24 00:00:00,IMF
jeroen dijsselbloem,"That’s right. Thank you for your remark. Um, the floor is to new ministers, who can I give the floor? Uh, any of-",2015-02-24 00:00:00,EG President
wolfgang schäuble,"If I may… uh, uh, Jeroen, if I may I can, I can say a few words.",2015-02-24 00:00:00,Germany
jeroen dijsselbloem,"Please, Wolfgang.",2015-02-24 00:00:00,EG President
